smartctl 7.5 2025-04-30 r5714 [x86_64-linux-6.12.41-gentoo] (local build)
Copyright (C) 2002-25, Bruce Allen, Christian Franke, www.smartmontools.org

=== START OF INFORMATION SECTION ===
Device Model:     SanDisk SD7TB3Q-256G-1006
Serial Number:    152490400448
LU WWN Device Id: 5 001b44 e8cb7d6c0
Firmware Version: X2180306
[REDACTED_USER] Capacity:    256,060,514,304 bytes [256 GB]
Sector Sizes:     512 bytes logical, 4096 bytes physical
Rotation Rate:    Solid State Device
Form Factor:      2.5 inches
TRIM Command:     Available, deterministic, zeroed
Device is:        Not in smartctl database 7.5/5706
ATA Version is:   ACS-2 T13/2015-D revision 3
SATA Version is:  SATA 3.2, 6.0 Gb/s (current: 6.0 Gb/s)
Local Time is:    Fri Oct 24 00:12:19 2025 CEST
SMART support is: Available - device has SMART capability.
SMART support is: Enabled
AAM feature is:   Unavailable
APM level is:     128 (minimum power consumption without standby)
Rd look-ahead is: Enabled
Write cache is:   Enabled
DSN feature is:   Unavailable
ATA Security is:  Disabled, NOT FROZEN [SEC1]

=== START OF READ SMART DATA SECTION ===
SMART overall-health self-assessment test result: PASSED
See vendor-specific Attribute list for marginal Attributes.

General SMART Values:
Offline data collection status:  (0x82)	Offline data collection activity
					was completed without error.
					Auto Offline Data Collection: Enabled.
Self-test execution status:      (   0)	The previous self-test routine completed
					without error or no self-test has ever 
					been run.
Total time to complete Offline 
data collection: 		(  120) seconds.
Offline data collection
capabilities: 			 (0x5b) SMART execute Offline immediate.
					Auto Offline data collection on/off support.
					Suspend Offline collection upon new
					command.
					Offline surface scan supported.
					Self-test supported.
					No Conveyance Self-test supported.
					Selective Self-test supported.
SMART capabilities:            (0x0003)	Saves SMART data before entering
					power-saving mode.
					Supports SMART auto save timer.
Error logging capability:        (0x01)	Error logging supported.
					General Purpose Logging supported.
Short self-test routine 
recommended polling time: 	 (   2) minutes.
Extended self-test routine
recommended polling time: 	 (  17) minutes.
SCT capabilities: 	       (0x003d)	SCT Status supported.
					SCT Error Recovery Control supported.
					SCT Feature Control supported.
					SCT Data Table supported.

SMART Attributes Data Structure revision number: 16
Vendor Specific SMART Attributes with Thresholds:
ID# ATTRIBUTE_NAME          FLAGS    VALUE WORST THRESH FAIL RAW_VALUE
  1 Raw_Read_Error_Rate     POSR-K   252   252   002    -    0
  5 Reallocated_Sector_Ct   PO--CK   252   252   005    -    0
  9 Power_On_Hours          -O--CK   021   021   ---    -    35024
 12 Power_Cycle_Count       -O--CK   252   252   ---    -    914
170 Unknown_Attribute       PO--CK   100   100   010    -    0
171 Unknown_Attribute       -O---K   100   100   ---    -    0
172 Unknown_Attribute       -O--CK   100   100   ---    -    0
173 Unknown_Attribute       PO--CK   094   094   005    -    863310643213
174 Unknown_Attribute       -O--CK   252   252   ---    -    113
183 Runtime_Bad_Block       -O--CK   100   100   000    -    0
184 End-to-End_Error        PO--CK   100   100   097    -    0
187 Reported_Uncorrect      -O--CK   100   100   ---    -    0
188 Command_Timeout         -O--CK   075   002   ---    -    51808
190 Airflow_Temperature_Cel -O---K   064   032   045    Past 36
196 Reallocated_Event_Count -O--CK   252   252   ---    -    0
199 UDMA_CRC_Error_Count    -O---K   100   100   ---    -    0
244 Unknown_Attribute       -O--CK   000   100   ---    -    0
                            ||||||_ K auto-keep
                            |||||__ C event count
                            ||||___ R error rate
                            |||____ S speed/performance
                            ||_____ O updated online
                            |______ P prefailure warning

General Purpose Log Directory Version 1
SMART           Log Directory Version 1 [multi-sector log support]
Address    Access  R/W   Size  Description
0x00       GPL,SL  R/O      1  Log Directory
0x01           SL  R/O      1  Summary SMART error log
0x02           SL  R/O      2  Comprehensive SMART error log
0x03       GPL     R/O      1  Ext. Comprehensive SMART error log
0x04       GPL,SL  R/O      8  Device Statistics log
0x06           SL  R/O      1  SMART self-test log
0x07       GPL     R/O      1  Extended self-test log
0x09           SL  R/W      1  Selective self-test log
0x10       GPL     R/O      1  NCQ Command Error log
0x11       GPL     R/O      1  SATA Phy Event Counters log
0x30       GPL,SL  R/O      9  IDENTIFY DEVICE data log
0x80-0x9f  GPL,SL  R/W     16  Host vendor specific log
0xb6       GPL     VS     127  Device vendor specific log
0xde       GPL     VS       8  Device vendor specific log
0xe0       GPL,SL  R/W      1  SCT Command/Status
0xe1       GPL,SL  R/W      1  SCT Data Transfer

SMART Extended Comprehensive Error Log Version: 1 (1 sectors)
No Errors Logged

SMART Error Log Version: 1
No Errors Logged

SMART Extended Self-test Log Version: 1 (1 sectors)
Num  Test_Description    Status                  Remaining  LifeTime(hours)  LBA_of_first_error
# 1  Extended offline    Aborted by host               00%     34288         -
# 2  Short offline       Completed without error       00%         1         -

SMART Self-test log structure revision number 1
Num  Test_Description    Status                  Remaining  LifeTime(hours)  LBA_of_first_error
# 1  Extended offline    Aborted by host               00%     34288         -
# 2  Short offline       Completed without error       00%         1         -

SMART Selective self-test log data structure revision number 1
 SPAN  MIN_LBA  MAX_LBA  CURRENT_TEST_STATUS
    1        0        0  Not_testing
    2        0        0  Not_testing
    3        0        0  Not_testing
    4        0        0  Not_testing
    5        0        0  Not_testing
Selective self-test flags (0x0):
  After scanning selected spans, do NOT read-scan remainder of disk.
If Selective self-test is pending on power-up, resume after 0 minute delay.

SCT Status Version:                  3
SCT Version (vendor specific):       257 (0x0101)
Device State:                        Active (0)
Current Temperature:                     ? Celsius
Power Cycle Min/Max Temperature:      ?/ ? Celsius
Lifetime    Min/Max Temperature:      ?/ ? Celsius
Under/Over Temperature Limit Count:   0/0
Vendor specific:
00 00 00 00 00 00 00 00 00 00 00 00 00 00 00 00
01 00 01 00 01 00 00 00 00 00 00 00 00 00 00 00

SCT Temperature History Version:     2
Temperature Sampling Period:         1 minute
Temperature Logging Interval:        1 minute
Min/Max recommended Temperature:     -10/70 Celsius
Min/Max Temperature Limit:           -15/90 Celsius
Temperature History Size (Index):    256 (14)

Index    Estimated Time   Temperature Celsius
  15    2025-10-23 19:57    33  **************
  16    2025-10-23 19:58    26  *******
  17    2025-10-23 19:59    29  **********
  18    2025-10-23 20:00    30  ***********
  19    2025-10-23 20:01    30  ***********
  20    2025-10-23 20:02    29  **********
  21    2025-10-23 20:03    33  **************
  22    2025-10-23 20:04    34  ***************
  23    2025-10-23 20:05    32  *************
  24    2025-10-23 20:06    32  *************
  25    2025-10-23 20:07    28  *********
  26    2025-10-23 20:08    31  ************
  27    2025-10-23 20:09    30  ***********
  28    2025-10-23 20:10    33  **************
  29    2025-10-23 20:11    31  ************
  30    2025-10-23 20:12    34  ***************
  31    2025-10-23 20:13    31  ************
  32    2025-10-23 20:14    28  *********
  33    2025-10-23 20:15    29  **********
  34    2025-10-23 20:16    31  ************
  35    2025-10-23 20:17    30  ***********
  36    2025-10-23 20:18    31  ************
  37    2025-10-23 20:19    30  ***********
  38    2025-10-23 20:20    36  *****************
  39    2025-10-23 20:21    38  *******************
  40    2025-10-23 20:22    40  *********************
  41    2025-10-23 20:23    40  *********************
  42    2025-10-23 20:24    41  **********************
  43    2025-10-23 20:25    42  ***********************
  44    2025-10-23 20:26    36  *****************
  45    2025-10-23 20:27    39  ********************
  46    2025-10-23 20:28    40  *********************
  47    2025-10-23 20:29    41  **********************
  48    2025-10-23 20:30    42  ***********************
  49    2025-10-23 20:31    42  ***********************
  50    2025-10-23 20:32    43  ************************
 ...    ..(  3 skipped).    ..  ************************
  54    2025-10-23 20:36    43  ************************
  55    2025-10-23 20:37    44  *************************
 ...    ..(  3 skipped).    ..  *************************
  59    2025-10-23 20:41    44  *************************
  60    2025-10-23 20:42    43  ************************
  61    2025-10-23 20:43    42  ***********************
 ...    ..(  5 skipped).    ..  ***********************
  67    2025-10-23 20:49    42  ***********************
  68    2025-10-23 20:50    43  ************************
  69    2025-10-23 20:51    43  ************************
  70    2025-10-23 20:52    44  *************************
 ...    ..( 15 skipped).    ..  *************************
  86    2025-10-23 21:08    44  *************************
  87    2025-10-23 21:09    45  **************************
 ...    ..( 21 skipped).    ..  **************************
 109    2025-10-23 21:31    45  **************************
 110    2025-10-23 21:32    44  *************************
 111    2025-10-23 21:33    44  *************************
 112    2025-10-23 21:34    45  **************************
 ...    ..(  2 skipped).    ..  **************************
 115    2025-10-23 21:37    45  **************************
 116    2025-10-23 21:38    44  *************************
 ...    ..(  5 skipped).    ..  *************************
 122    2025-10-23 21:44    44  *************************
 123    2025-10-23 21:45    43  ************************
 124    2025-10-23 21:46    33  **************
 125    2025-10-23 21:47    38  *******************
 126    2025-10-23 21:48    40  *********************
 127    2025-10-23 21:49    40  *********************
 128    2025-10-23 21:50    40  *********************
 129    2025-10-23 21:51    35  ****************
 130    2025-10-23 21:52    39  ********************
 131    2025-10-23 21:53    40  *********************
 132    2025-10-23 21:54    41  **********************
 133    2025-10-23 21:55    42  ***********************
 ...    ..(  2 skipped).    ..  ***********************
 136    2025-10-23 21:58    42  ***********************
 137    2025-10-23 21:59    43  ************************
 ...    ..(  7 skipped).    ..  ************************
 145    2025-10-23 22:07    43  ************************
 146    2025-10-23 22:08    44  *************************
 147    2025-10-23 22:09    44  *************************
 148    2025-10-23 22:10    44  *************************
 149    2025-10-23 22:11    43  ************************
 150    2025-10-23 22:12    44  *************************
 ...    ..( 98 skipped).    ..  *************************
 249    2025-10-23 23:51    44  *************************
 250    2025-10-23 23:52    43  ************************
 251    2025-10-23 23:53    44  *************************
 ...    ..(  2 skipped).    ..  *************************
 254    2025-10-23 23:56    44  *************************
 255    2025-10-23 23:57    43  ************************
   0    2025-10-23 23:58    44  *************************
   1    2025-10-23 23:59    42  ***********************
   2    2025-10-24 00:00    43  ************************
   3    2025-10-24 00:01    43  ************************
   4    2025-10-24 00:02    44  *************************
   5    2025-10-24 00:03    44  *************************
   6    2025-10-24 00:04    43  ************************
   7    2025-10-24 00:05    43  ************************
   8    2025-10-24 00:06    42  ***********************
   9    2025-10-24 00:07    32  *************
  10    2025-10-24 00:08    36  *****************
  11    2025-10-24 00:09    37  ******************
  12    2025-10-24 00:10    31  ************
  13    2025-10-24 00:11    32  *************
  14    2025-10-24 00:12    35  ****************

SCT Error Recovery Control:
           Read: Disabled
          Write: Disabled

Device Statistics (GP Log 0x04)
Page  Offset Size        Value Flags Description
0x01  =====  =               =  ===  == General Statistics (rev 2) ==
0x01  0x008  4             914  ---  Lifetime Power-On Resets
0x01  0x018  6  41020393600447  ---  Logical Sectors Written
0x01  0x020  6       180475380  ---  Number of Write Commands
0x01  0x028  6  32388785187205  ---  Logical Sectors Read
0x01  0x030  6       636437451  ---  Number of Read Commands
0x07  =====  =               =  ===  == Solid State Device Statistics (rev 1) ==
0x07  0x008  1               6  ---  Percentage Used Endurance Indicator
                                |||_ C monitored condition met
                                ||__ D supports DSN
                                |___ N normalized value

Pending Defects log (GP Log 0x0c) not supported

SATA Phy Event Counters (GP Log 0x11)
ID      Size     Value  Description
0x0001  4            0  Command failed due to ICRC error
0x0002  4            0  R_ERR response for data FIS
0x0005  4            0  R_ERR response for non-data FIS
0x000a  4           36  Device-to-host register FISes sent due to a COMRESET

