smartctl 7.5 2025-04-30 r5714 [x86_64-linux-6.16.10-200.fc42.x86_64] (local build)
Copyright (C) 2002-25, Bruce Allen, Christian Franke, www.smartmontools.org

=== START OF INFORMATION SECTION ===
Model Number:                       ADATA LEGEND 800
Serial Number:                      2N152LAGA9YR
Firmware Version:                   V1122B0
PCI Vendor/Subsystem ID:            0x1cc1
IEEE OUI Identifier:                0x707c18
Controller ID:                      1
NVMe Version:                       1.4
Number of Namespaces:               1
Namespace 1 Size/Capacity:          1,000,204,886,016 [1.00 TB]
Namespace 1 Formatted LBA Size:     512
Namespace 1 IEEE EUI-64:            707c18 0215020aa9
Local Time is:                      Sat Oct 11 14:49:23 2025 CEST
Firmware Updates (0x12):            1 Slot, no Reset required
Optional [REDACTED_USER] Commands (0x0016):   Format Frmw_DL Self_Test
Optional NVM Commands (0x009f):     Comp Wr_Unc DS_Mngmt Wr_Zero Sav/Sel_Feat Verify
Log Page Attributes (0x12):         Cmd_Eff_Lg Pers_Ev_Lg
Maximum Data Transfer Size:         64 Pages
Warning  Comp. Temp. Threshold:     83 Celsius
Critical Comp. Temp. Threshold:     90 Celsius

Supported Power States
St Op     Max   Active     Idle   RL RT WL WT  Ent_Lat  Ex_Lat
 0 +     5.00W       -        -    0  0  0  0        0       0
 1 +     3.50W       -        -    1  1  1  1        0     200
 2 +     2.50W       -        -    2  2  2  2        0    1000
 3 -     1.50W       -        -    3  3  3  3     5000    5000
 4 -     1.50W       -        -    4  4  4  4    20000   70000

Supported LBA Sizes (NSID 0x1)
Id Fmt  Data  Metadt  Rel_Perf
 0 +     512       0         0

=== START OF SMART DATA SECTION ===
SMART overall-health self-assessment test result: PASSED

SMART/Health Information (NVMe Log 0x02, NSID 0xffffffff)
Critical Warning:                   0x00
Temperature:                        49 Celsius
Available Spare:                    100%
Available Spare Threshold:          10%
Percentage Used:                    3%
Data Units Read:                    115,755,629 [59.2 TB]
Data Units Written:                 36,692,468 [18.7 TB]
Host Read Commands:                 727,268,655
Host Write Commands:                400,579,471
Controller Busy Time:               39,832
Power Cycles:                       1,834
Power On Hours:                     13,524
Unsafe Shutdowns:                   373
Media and Data Integrity Errors:    0
Error Information Log Entries:      0
Warning  Comp. Temperature Time:    792
Critical Comp. Temperature Time:    166

Error Information (NVMe Log 0x01, 16 of 64 entries)
No Errors Logged

Self-test Log (NVMe Log 0x06, NSID 0xffffffff)
Self-test status: No self-test in progress
Num  Test_Description  Status                       Power_on_Hours  Failing_LBA  NSID Seg SCT Code
 0   Extended          Completed without error               12925            -     -   -   -    -
 1   Extended          Completed without error               12925            -     -   -   -    -
 2   Extended          Completed without error                  49            -     -   -   -    -
 3   Short             Completed without error                  49            -     -   -   -    -

