smartctl 7.5 2025-04-30 r5714 [x86_64-linux-6.12.41-gentoo] (local build)
Copyright (C) 2002-25, Bruce Allen, Christian Franke, www.smartmontools.org

=== START OF INFORMATION SECTION ===
Model Number:                       MTFDKBA1T0TFH-1BC1AABHA
Serial Number:                      UMDMD01J1IZ9A9
Firmware Version:                   HPS0043
PCI Vendor/Subsystem ID:            0x1344
IEEE OUI Identifier:                0x00a075
Total NVM Capacity:                 1,024,209,543,168 [1.02 TB]
Unallocated NVM Capacity:           0
Controller ID:                      0
NVMe Version:                       1.4
Number of Namespaces:               1
Namespace 1 Size/Capacity:          1,024,209,543,168 [1.02 TB]
Namespace 1 Formatted LBA Size:     512
Namespace 1 IEEE EUI-64:            00a075 01462334b1
Local Time is:                      Thu Oct 23 07:47:37 2025 -00
Firmware Updates (0x14):            2 Slots, no Reset required
Optional [REDACTED_USER] Commands (0x0017):   Security Format Frmw_DL Self_Test
Optional NVM Commands (0x0057):     Comp Wr_Unc DS_Mngmt Sav/Sel_Feat Timestmp
Log Page Attributes (0x1b):         S/H_per_NS Cmd_Eff_Lg Telmtry_Lg Pers_Ev_Lg
Maximum Data Transfer Size:         512 Pages
Warning  Comp. Temp. Threshold:     80 Celsius
Critical Comp. Temp. Threshold:     82 Celsius
Namespace 1 Features (0x08):        No_ID_Reuse

Supported Power States
St Op     Max   Active     Idle   RL RT WL WT  Ent_Lat  Ex_Lat
 0 +     8.25W       -        -    0  0  0  0        0       0
 1 +     4.00W       -        -    1  1  1  1        0       0
 2 +     2.00W       -        -    2  2  2  2        0       0
 3 -   0.1000W       -        -    3  3  3  3     5000    6000
 4 -   0.0050W       -        -    4  4  4  4    12000   35000

Supported LBA Sizes (NSID 0x1)
Id Fmt  Data  Metadt  Rel_Perf
 0 +     512       0         0

=== START OF SMART DATA SECTION ===
SMART overall-health self-assessment test result: PASSED

SMART/Health Information (NVMe Log 0x02, NSID 0x1)
Critical Warning:                   0x00
Temperature:                        39 Celsius
Available Spare:                    100%
Available Spare Threshold:          5%
Percentage Used:                    3%
Data Units Read:                    22,693,018 [11.6 TB]
Data Units Written:                 30,664,635 [15.7 TB]
Host Read Commands:                 182,762,441
Host Write Commands:                415,460,569
Controller Busy Time:               260
Power Cycles:                       232
Power On Hours:                     171
Unsafe Shutdowns:                   54
Media and Data Integrity Errors:    0
Error Information Log Entries:      345
Warning  Comp. Temperature Time:    0
Critical Comp. Temperature Time:    0
Temperature Sensor 1:               39 Celsius

Error Information (NVMe Log 0x01, 16 of 256 entries)
Num   ErrCount  SQId   CmdId  Status  PELoc          LBA  NSID    VS  Message
  0        345     0  0x1011  0x8004  0x000            0     0     -  Invalid Field in Command

Self-test Log (NVMe Log 0x06, NSID 0xffffffff)
Self-test status: No self-test in progress
Num  Test_Description  Status                       Power_on_Hours  Failing_LBA  NSID Seg SCT Code
 0   Short             Completed without error                  10            -     -   -   -    -
 1   Short             Completed without error                   9            -     -   -   -    -

